<?xml version="1.0" encoding="UTF-8" standalone="no" ?>
<RiskProfileTree xmlns:xsi="http://www.w3.org/2001/XMLSchema-instance" xsi:noNamespaceSchemaLocation="../xsd/InherentRiskProfile.xsd">
  <RiskProfileNode>
    <Profile_ID>RI0700100000</Profile_ID>
    <risiko_name>Risiko Stratejik</risiko_name>
    <assessment_factor>Kesesuaian Strategi dengan Kondisi Lingkungan Bisnis</assessment_factor>
    <weight>0</weight>
    <ID>1266</ID>
    <Risk_ID>14</Risk_ID>
    <RiskProfileNode>
      <Profile_ID>RI0700100107</Profile_ID>
      <risiko_name>Risiko Stratejik</risiko_name>
      <assessment_factor>1.1.4.3 Pembiayaan - Gearing Ratio</assessment_factor>
      <weight>0</weight>
      <ID>695</ID>
      <Risk_ID>14</Risk_ID>
    </RiskProfileNode>
    <RiskProfileNode>
      <Profile_ID>RI0700100108</Profile_ID>
      <risiko_name>Risiko Stratejik</risiko_name>
      <assessment_factor>1.1.4.4 Modal Kerja Bersih Disesuaikan (MKBD) Sekuritas</assessment_factor>
      <weight>0</weight>
      <ID>1275</ID>
      <Risk_ID>14</Risk_ID>
    </RiskProfileNode>
    <RiskProfileNode>
      <Profile_ID>RI0700100109</Profile_ID>
      <risiko_name>Risiko Stratejik</risiko_name>
      <assessment_factor>1.1.4.5 Modal Kerja Bersih Disesuaikan (MKBD) Asset Management</assessment_factor>
      <weight>0</weight>
      <ID>697</ID>
      <Risk_ID>14</Risk_ID>
    </RiskProfileNode>
    <RiskProfileNode>
      <Profile_ID>RI0700100200</Profile_ID>
      <risiko_name>Risiko Stratejik</risiko_name>
      <assessment_factor>1.2 Faktor eksternal, antara lain:</assessment_factor>
      <weight>0</weight>
      <ID>1308</ID>
      <Risk_ID>14</Risk_ID>
    </RiskProfileNode>
    <RiskProfileNode>
      <Profile_ID>RI0700100201</Profile_ID>
      <risiko_name>Risiko Stratejik</risiko_name>
      <assessment_factor>1.2.1 Perkembangan teknologI

(Dampak Perkembangan Teknologi yang diserap oleh LJK)</assessment_factor>
      <weight>0</weight>
      <ID>1309</ID>
      <Risk_ID>14</Risk_ID>
    </RiskProfileNode>
    <RiskProfileNode>
      <Profile_ID>RI0700100202</Profile_ID>
      <risiko_name>Risiko Stratejik</risiko_name>
      <assessment_factor>1.2.2 Tingkat persaingan usaha.</assessment_factor>
      <weight>0</weight>
      <ID>1310</ID>
      <Risk_ID>14</Risk_ID>
      <threshold>(Bidang Usaha yang dimiliki oleh Konglomerasi Keuangan Sinar Mas sangat variatif) ? 1 : (Bidang Usaha yang dimiliki oleh Konglomerasi Keuangan Sinar Mas variatif) ? 2 : (Bidang Usaha yang dimiliki oleh Konglomerasi Keuangan Sinar Mas cukup variatif) ? 3 : (Bidang Usaha yang dimiliki oleh Konglomerasi Keuangan Sinar Mas kurang variatif) ? 4 : 5</threshold>
    </RiskProfileNode>
    <RiskProfileNode>
      <Profile_ID>RI0700100100</Profile_ID>
      <risiko_name>Risiko Stratejik</risiko_name>
      <assessment_factor>1.1 Faktor internal, antara lain:</assessment_factor>
      <weight>0</weight>
      <ID>688</ID>
      <Risk_ID>14</Risk_ID>
    </RiskProfileNode>
    <RiskProfileNode>
      <Profile_ID>RI0700100101</Profile_ID>
      <risiko_name>Risiko Stratejik</risiko_name>
      <assessment_factor>1.1.1 Visi, misi, dan arah bisnis yang ingin dicapai oleh LJK</assessment_factor>
      <weight>0</weight>
      <ID>1299</ID>
      <Risk_ID>14</Risk_ID>
    </RiskProfileNode>
    <RiskProfileNode>
      <Profile_ID>RI0700100102</Profile_ID>
      <risiko_name>Risiko Stratejik</risiko_name>
      <assessment_factor>1.1.2 Kultur organisasi, terutama jika penetapan tujuan stratejik mensyaratkan perubahan struktur organisasi dan penyesuaian proses bisnis;</assessment_factor>
      <weight>0</weight>
      <ID>1300</ID>
      <Risk_ID>14</Risk_ID>
    </RiskProfileNode>
    <RiskProfileNode>
      <Profile_ID>RI0700100103</Profile_ID>
      <risiko_name>Risiko Stratejik</risiko_name>
      <assessment_factor>1.1.3 Faktor kemampuan organisasi yang mencakup antara lain sumber daya manusia, infrastruktur, dan sistem informasi manajemen;</assessment_factor>
      <weight>0</weight>
      <ID>1301</ID>
      <Risk_ID>14</Risk_ID>
    </RiskProfileNode>
    <RiskProfileNode>
      <Profile_ID>RI0700100104</Profile_ID>
      <risiko_name>Risiko Stratejik</risiko_name>
      <assessment_factor>1.1.4 Tingkat toleransi Risiko yaitu tingkat kemampuan keuangan LJK menyerap Risiko; dan</assessment_factor>
      <weight>0</weight>
      <ID>1302</ID>
      <Risk_ID>14</Risk_ID>
    </RiskProfileNode>
    <RiskProfileNode>
      <Profile_ID>RI0700100105</Profile_ID>
      <risiko_name>Risiko Stratejik</risiko_name>
      <assessment_factor>1.1.4.1 Bank - Rasio Capital Adequancy Ratio (CAR)</assessment_factor>
      <weight>0</weight>
      <ID>1272</ID>
      <Risk_ID>14</Risk_ID>
    </RiskProfileNode>
    <RiskProfileNode>
      <Profile_ID>RI0700100106</Profile_ID>
      <risiko_name>Risiko Stratejik</risiko_name>
      <assessment_factor>1.1.4.2 Asuransi - Risk Based Capital (RBC)</assessment_factor>
      <weight>0</weight>
      <ID>694</ID>
      <Risk_ID>14</Risk_ID>
    </RiskProfileNode>
  </RiskProfileNode>
  <RiskProfileNode>
    <Profile_ID>RI0300400000</Profile_ID>
    <risiko_name>Risiko Likuiditas</risiko_name>
    <assessment_factor>Akses pada Sumber-Sumber Pendanaan</assessment_factor>
    <weight>0</weight>
    <ID>1156</ID>
    <Risk_ID>10</Risk_ID>
    <RiskProfileNode>
      <Profile_ID>RI0300400100</Profile_ID>
      <risiko_name>Risiko Likuiditas</risiko_name>
      <assessment_factor>4.1 Kemampuan Konglomerasi Keuangan memperoleh sumber-sumber pendanaan pada kondisi normal maupun krisis</assessment_factor>
      <weight>0</weight>
      <ID>1157</ID>
      <Risk_ID>10</Risk_ID>
      <threshold>(Sangat Mampu) ? 1 : (Mampu) ? 2 : (Cukup Mampu) ? 3 : (Kurang Mampu) ? 4 : 5</threshold>
    </RiskProfileNode>
  </RiskProfileNode>
  <RiskProfileNode>
    <Profile_ID>RI0600400000</Profile_ID>
    <risiko_name>Risiko Reputasi</risiko_name>
    <assessment_factor>Faktor Eksternal</assessment_factor>
    <weight>0</weight>
    <ID>680</ID>
    <Risk_ID>15</Risk_ID>
    <RiskProfileNode>
      <Profile_ID>RI0600400200</Profile_ID>
      <risiko_name>Risiko Reputasi</risiko_name>
      <assessment_factor>4.2 Jenis media dan ruang lingkup pemberitaan negatif

(Jenis pemberitaan negatif media atau ruang lingkup)</assessment_factor>
      <weight>0</weight>
      <ID>683</ID>
      <Risk_ID>15</Risk_ID>
    </RiskProfileNode>
    <RiskProfileNode>
      <Profile_ID>RI0600400101</Profile_ID>
      <risiko_name>Risiko Reputasi</risiko_name>
      <assessment_factor>4.1.1 Frekuensi pemberitaan negatif.</assessment_factor>
      <weight>0</weight>
      <ID>681</ID>
      <Risk_ID>15</Risk_ID>
    </RiskProfileNode>
    <RiskProfileNode>
      <Profile_ID>RI0600400102</Profile_ID>
      <risiko_name>Risiko Reputasi</risiko_name>
      <assessment_factor>4.1.2 Materialitas (realisasi kerugian) pemberitaan negatif

(Nominal realisasi kerugian atas pemberitaan negatif terhadap rata-rata total modal)</assessment_factor>
      <weight>0</weight>
      <ID>682</ID>
      <Risk_ID>15</Risk_ID>
    </RiskProfileNode>
  </RiskProfileNode>
  <RiskProfileNode>
    <Profile_ID>RI1100100000</Profile_ID>
    <risiko_name>Risiko Investasi</risiko_name>
    <assessment_factor>Komposisi dan Tingkat Kosentrasi Pembiayaan Berbasis Bagi Hasil</assessment_factor>
    <weight>0</weight>
    <ID>782</ID>
    <Risk_ID>20</Risk_ID>
    <RiskProfileNode>
      <Profile_ID>RI1100100200</Profile_ID>
      <risiko_name>Risiko Investasi</risiko_name>
      <assessment_factor>1.2 Pembiayaan Berbasis Bagi Hasil per Sektor Ekonomi /
Total Pembiayaan</assessment_factor>
      <weight>0</weight>
      <ID>784</ID>
      <Risk_ID>20</Risk_ID>
    </RiskProfileNode>
    <RiskProfileNode>
      <Profile_ID>RI1100100100</Profile_ID>
      <risiko_name>Risiko Investasi</risiko_name>
      <assessment_factor>1.1 Total Pembiayaan Berbasis Bagi Hasil/
Total Pembiayaan</assessment_factor>
      <weight>0</weight>
      <ID>783</ID>
      <Risk_ID>20</Risk_ID>
    </RiskProfileNode>
  </RiskProfileNode>
  <RiskProfileNode>
    <Profile_ID>RI0300300000</Profile_ID>
    <risiko_name>Risiko Likuiditas</risiko_name>
    <assessment_factor>Kerentanan pada Kebutuhan Pendanaan</assessment_factor>
    <weight>0</weight>
    <ID>1153</ID>
    <Risk_ID>10</Risk_ID>
    <RiskProfileNode>
      <Profile_ID>RI0300300200</Profile_ID>
      <risiko_name>Risiko Likuiditas</risiko_name>
      <assessment_factor>3.2 Menjaga minimum likuiditas (Current Ratio)</assessment_factor>
      <weight>0</weight>
      <ID>1155</ID>
      <Risk_ID>10</Risk_ID>
      <threshold>(value &gt; 1.00) ? 1 : (90 &lt; value &lt;= 1.00) ? 2 : (80 &lt; value &lt;= 0.90) ? 3 : (70 &lt; value &lt;= 0.80) ? 4 : 5</threshold>
    </RiskProfileNode>
    <RiskProfileNode>
      <Profile_ID>RI0300300100</Profile_ID>
      <risiko_name>Risiko Likuiditas</risiko_name>
      <assessment_factor>3.1 Kerentanan Konglomerasi Keuangan pada kebutuhan pendanaan dan kemampuan Konglomerasi Keuangan untuk memenuhi kebutuhan pendanaan</assessment_factor>
      <weight>0</weight>
      <ID>1154</ID>
      <Risk_ID>10</Risk_ID>
      <threshold>(value &gt; 0.70) ? 1 : (60 &lt; value &lt;= 0.70) ? 2 : (50 &lt; value &lt;= 0.60) ? 3 : (40 &lt; value &lt;= 0.50) ? 4 : 5</threshold>
    </RiskProfileNode>
  </RiskProfileNode>
  <RiskProfileNode>
    <Profile_ID>RI0600300000</Profile_ID>
    <risiko_name>Risiko Reputasi</risiko_name>
    <assessment_factor>Kompleksitas Produk dan Kerjasama Bisnis LJK dalam Konglomerasi Keuangan</assessment_factor>
    <weight>0</weight>
    <ID>677</ID>
    <Risk_ID>15</Risk_ID>
    <RiskProfileNode>
      <Profile_ID>RI0600300200</Profile_ID>
      <risiko_name>Risiko Reputasi</risiko_name>
      <assessment_factor>3.2 Jumlah dan materialitas kerjasama LJK dalam Konglomerasi Keuangan dengan mitra bisnis, dalam hal terdapat potensi adanya kejadian yang mempengaruhi reputasi mitra bisnis.